<?xml version="1.0" encoding="UTF-8"?>
<!DOCTYPE FormData SYSTEM "FormData.dtd">
<FormData>
    <Form id="FireRankForm">
        <Colum Key="Artillery">
            <Row Key="1">10</Row>
            <Row Key="2">10</Row>
            <Row Key="3">9</Row>
            <Row Key="4">9</Row>
            <Row Key="5">8</Row>
            <Row Key="6">8</Row>
            <Row Key="7">7</Row>
            <Row Key="8">7</Row>
            <Row Key="9">7</Row>
            <Row Key="10">7</Row>
        </Colum>

        <Colum Key="SP-Artillery">
            <Row Key="1">10</Row>
            <Row Key="2">10</Row>
            <Row Key="3">10</Row>
            <Row Key="4">10</Row>
            <Row Key="5">9</Row>
            <Row Key="6">9</Row>
            <Row Key="7">9</Row>
            <Row Key="8">8</Row>
            <Row Key="9">8</Row>
            <Row Key="10">8</Row>
            <Row Key="12">7</Row>
            <Row Key="14">7</Row>
            <Row Key="16">7</Row>
        </Colum>

        <Colum Key="Mortar">
            <Row Key="1">6</Row>
            <Row Key="2">6</Row>
            <Row Key="3">5</Row>
            <Row Key="4">4</Row>
            <Row Key="5">3</Row>
        </Colum>

        <Colum Key="SP-Mortar">
            <Row Key="1">8</Row>
            <Row Key="2">8</Row>
            <Row Key="3">8</Row>
            <Row Key="4">7</Row>
            <Row Key="5">7</Row>
            <Row Key="6">7</Row>
            <Row Key="7">6</Row>
        </Colum>

        <Colum Key="Rocket">
            <Row Key="1">12</Row>
            <Row Key="2">12</Row>
            <Row Key="3">12</Row>
            <Row Key="4">12</Row>
            <Row Key="5">11</Row>
            <Row Key="6">11</Row>
            <Row Key="7">11</Row>
            <Row Key="8">10</Row>
            <Row Key="9">10</Row>
            <Row Key="10">9</Row>
            <Row Key="12">9</Row>
            <Row Key="14">8</Row>
            <Row Key="16">8</Row>
            <Row Key="18">7</Row>
            <Row Key="20">7</Row>
        </Colum>

        <Colum Key="Machine-Grope">
            <Row Key="1">10</Row>
            <Row Key="2">9</Row>
            <Row Key="3">9</Row>
            <Row Key="4">9</Row>
            <Row Key="5">8</Row>
            <Row Key="6">8</Row>
            <Row Key="7">8</Row>
            <Row Key="8">7</Row>
            <Row Key="9">7</Row>
            <Row Key="10">6</Row>
            <Row Key="12">6</Row>
        </Colum>
    </Form>
</FormData>